ï»¿tekst;fag
Rektangulære kanaler skal trykkprøves separat.;Ventilasjon
Tetthetsprøving skal utføres etter NS3420-V.Dersom kravet til spesifisert trykklasse ikke oppnåsplikter entreprenøren for egen regning å utbedre/tettelekkasjen.;Ventilasjon
Tetthetsprøving skal utføres etter NS3420-V.Dersom kravet til spesifisert trykklasse ikke oppnåsplikter entreprenøren for egen regning å utbedre/tette lekkasjen.;Ventilasjon
Størrelse på plenumskamre kontrolleres opp mot plass iteknisk rom og størrelse på tegninger førbestilling/produksjon igangsettes.;Ventilasjon
Merking på kanaler og rør skal alltid foretas minimum hver 15 meter.;Uspesifisert
Eksempelvis skal det henges opp brukanvisninger/veiledere for.;Uspesifisert
ï·lysstyringï·temperaturstyringï·styring av ventilasjonï·bruk av tøy- og bossug I tekniske rom skal det henges opp informasjonsplansjer som forteller hvordan de ulike systemene fungerer.;Uspesifisert
Eksempelvis skal det på hvert enkelt ventilasjonsaggregat henges opp en plakat med minimum følgende orientering.;Ventilasjon
ï·TFM-nummerï·Dekningsområdeï·Fabrikatï·Leverandør av aggregat og automatikkï·Luftmengderï·Trykkï·Innstillinger på frekvensomformerï·Hva aggregatet består av inkl. eventuelle kapasiteter I hoved- og underfordelinger skal følgende henges opp. o Enlinjeskjemao Tavleskjemao Styrestrømsskjema I hovedfordelinger skal det i tillegg henges opp.;Ventilasjon
Eksempel på komponenter som skal merkes med denne teksten som er pumper, tanker, ekspansjonskar, batterier, fancoiler, fordampere, filtre, følere, termostater, spjeld, spjeldmotorer og aggregatdeler.;Uspesifisert
