ï»¿tekst;fag
FDV-dokumentasjonen skal inneholde serviceintervaller per komponent og maler/protokoller for periodiske ettersyn, med ansvar og frekvens angitt.;byggautomasjon, ventilasjon, elektro, rørlegger, totalentreprenør
"Rør for varme og kjøling skal trykkprøves til 1,5 Ã driftstrykk i â¥ 2 timer uten trykkfall; signert trykkprøveprotokoll leveres.";rørlegger
"Alle motorventiler skal monteres med unionskoblinger for enkel utskifting uten driftsstans; strømningsretning merkes.";rørlegger
"Kompressorkrets skal ha sug- og væskeledning med oljeutskiller iht. produsentens anvisning; funksjon dokumenteres.";rørlegger
"Elektriske installasjoner skal utføres iht. FEL/NEK 400 og kontrolleres/måles (isolasjon, kontinuitet, jording) før spenningssetting; måleprotokoller vedlegges.";elektro
"Fleksible tilkoblinger til ventilasjonsaggregat skal være ikke-brennbare og tilfredsstille ISO 6944; produktsertifikat og merking dokumenteres.";ventilasjon
"SD-anlegget skal ha webgrensesnitt på lokalnett for byggherre med rollebasert pålogging og HTTPS; tilgangsoppsett dokumenteres.";byggautomasjon
"Det skal installeres temperatursensor i hver sone og kobles til SD for behovsstyrt regulering; sensorplassering og kalibrering dokumenteres.";byggautomasjon
"Ved oppstart skal kuldeanlegget innreguleres og igangkjøres av F-gass sertifisert kjølemontør; protokoll og parameterliste vedlegges.";kulde
"Testrapporter for isolasjonsmotstand, jordmotstand og spenningsfall skal leveres før overtakelse; målinger iht. NEK 400.";elektro
FDV-manualen skal inkludere anbefalte reservedeler (art.nr., antall, ledetid) og kontaktinformasjon til kritiske leverandører.;rørlegger
Alle tekniske data for SD-komponenter skal registreres i anleggets database med entydig tag/ID, adresse, enhet, skala og alarmgrenser.;byggautomasjon
"Rørføring gjennom yttervegg skal varmeisoleres og lufttettes med typegodkjent mansjett for å unngå kuldebro; fotodokumentasjon vedlegges.";rørlegger
"Avkastkanaler skal avsluttes â¥ 2,0 m over tak og plasseres i le av inntak; avstand og plassering målsattes på tegning.";ventilasjon
"Alle fordelingstavler skal ha dedikert overspenningsvern og automatsikringer tydelig merket med kursnummer; samsvar iht. NEK 400-534.";elektro
"Kuldemediefylling skal utføres med godkjent utstyr av sertifisert personell; type, mengde og GWP loggføres iht. F-gasskrav.";kulde
"Ventilasjonens bypass-spjeld skal funksjonstestes i både normaldrift og nødmodus; testprotokoll med posisjon/reaksjonstid vedlegges.";ventilasjon
SD-anleggets alarmlogger skal kunne eksporteres til Excel/CSV med tid, tag, prioritet og kvittering.;byggautomasjon
"Kursfortegnelse for tavler skal speile faktisk utførelse og være oppdatert før overlevering; utskrift/plansje skal være oppslått i hver tavle.";elektro
"Samtlige ventilasjonsfilter skal merkes med filterklasse og utskiftningsintervall; filterbytter og Îp loggføres i FDV.";ventilasjon
"Alle tilkoblinger i el-tavler skal momentdras iht. produsent/NEK 400 og termograferes ved â¥ 75 % last før idriftsettelse; protokoll vedlegges.";elektro
"Tekniske rom for kuldeanlegg skal ha automatisk ventilasjon med gassdeteksjon og tvangsstyrt avtrekk ved alarm iht. NS-EN 378; funksjon integreres i SD og testes.";ventilasjon
"Alle tappevannsledninger skal isoleres â¥ 30 mm mineralull med kontinuerlig dampbarriere der fuktrisiko foreligger; tykkelse dokumenteres.";rørlegger
"Alle vanninntak skal ha tilbakestrømssikring (min. EA/BA) iht. VA-norm/NS-EN 1717; plassering merkes på tegning og kontrolleres.";rørlegger
"Varmesentralen skal utstyres med sikkerhetsventil, ekspansjonskar og manometer, dimensjonert for anleggets volum/trykk; innstillinger dokumenteres.";rørlegger
"Kjøkkenavløp skal tilknyttes fettutskiller i samsvar med kommunale krav; dimensjonering og funksjonstest dokumenteres.";rørlegger
"Rør i våtrom skal legges med fall mot sluk (min. 1:100) og ha tilgjengelige inspeksjonspunkter; utførelse dokumenteres.";rørlegger
"Avløpsrør skal være av støydempet materiale og opphengt med vibrasjonsdempere iht. produktblad; lydkrav iht. NS 8175 skal oppfylles.";rørlegger
"Kobberrør i fordelingsnettet skal benytte pressfittingsystem (M/V-profil) med sertifisert verktøy; skjøter merkes og trykkprøves.";rørlegger
"Gulvvarmeanlegg skal reguleres med termostat per rom/sone og balanseres før overtakelse; innreguleringsprotokoll vedlegges.";rørlegger
"Kaldtvannsinstallasjoner skal utføres med legionellaforebyggende tiltak (unngå dødtlegger, riktig gjennomspyling/hygieneplan); tiltak dokumenteres.";rørlegger
"Sprinkleropplegg skal føres separat fra øvrige rør og merkes tydelig (rød) med systemkode/retning; plan vises på tegning.";rørlegger
"Alle tilluftsventiler skal ha justerbare spjeld og plasseres â¥ 2,1 m over gulv; innregulering dokumenteres.";ventilasjon
"Avtrekksluft skal føres via lydfeller før aggregat for å redusere støy; type og innsetting dokumenteres med datablad.";ventilasjon
"Ventilasjonskanaler over himling skal ha inspeksjonsluker for rengjøring ved forgreininger/retningsendringer og maks 10 m mellomrom; plassering vises på tegning.";ventilasjon
Kanalføringer i tekniske rom skal være i galvanisert stål og merkes iht. NS 3940 med systemkode, retning og mål.;ventilasjon
"Ventilasjonsaggregat/romstyring i undervisningsarealer skal ha integrert COâ-basert behovsstyring med prosjektert settpunkt; signaler integreres i SD og trendes.";ventilasjon
"Alle kanalgjennomføringer i brannskiller skal tettes med sertifiserte tetningssystemer til prosjektert EI-klasse; fotodokumentasjon vedlegges.";ventilasjon
"Datasentral skal tilføres luftmengde tilsvarende min. 6 luftvekslinger/time; beregning og måling dokumenteres.";ventilasjon
"Våtrom og kjøkken skal ha separat balansert ventilasjon med egen avkast; lukt-/smittespredning mellom soner skal hindres.";ventilasjon
"Tilluftfilter skal være min. ePM1 60 % iht. EN ISO 16890; alarmgrense for Îp oppgis og bytter loggføres i FDV.";ventilasjon
"Ventilasjonskanaler skal trykktestes og lekkasjemåles iht. NS-EN 12599 (min. lekkasjeklasse B); protokoll vedlegges.";ventilasjon
"Alle stikkontakter skal ha barnesikring og være utført iht. NEK 400; type og plassering dokumenteres.";elektro
"IT-utstyr i kontorlandskap skal ha separate kurser med dedikerte vern/merkede uttak; kursfortegnelse oppdateres.";elektro
Belysning i fellesarealer skal styres med bevegelsessensor og dagslysstyring (DALI) med etterlystid og minimumsnivå satt i as-built.;byggautomasjon, elektro
"Alle underfordelinger skal ha overspenningsvern (SPD) type 2 iht. NEK 400-534; koordinert med evt. type 1 i hovedfordeling, merket og dokumentert.";elektro
"Kabler gjennom brannskiller skal branntettes med sertifisert system til min. EI60; montasje etter systemgodkjenning og fotodokumentasjon vedlegges.";elektro
Alle kurser med stikkontakter skal ha selektiv jordfeilbryter (RCD) med IÎn â¤ 30 mA og dokumentert selektivitet mot oppstrøms vern.;elektro
"Føringsveier skal utføres i perforert kabelstige med oppheng c/c iht. produktblad, og utjevningsjordes i begge ender; kontinuitet dokumenteres.";elektro
"Det skal monteres utvendig stikkontakt ved hovedinngang og bakside; min. IP44 med RCD-beskyttelse, montert 0,8â1,2 m over terreng.";elektro
"Alle tavler skal ha tydelig merkeskjema med tilkoblingsoversikt; enkeltlinjeskjema og oppdatert kursfortegnelse skal være oppslått.";elektro
"Hvert rom skal ha minst Ã©n 16 A stikkontakt på egen kurs; kursnummer angis i kursfortegnelse og på utstyr.";elektro
"Kjølemediet skal være naturlig med lav GWP i tråd med F-gassforordningen; type og mengde dokumenteres i f-gass-logg.";kulde
"Alle kjølerør skal isoleres med diffusjonstett cellegummi for å hindre kondens og energitap; tykkelse iht. beregning, skjøter limes og tapes.";kulde
Fordamper i kjølerom skal ha automatisk avriming og dryppanne med avløp ført til sluk med fall â¥ 1:100 og vannlås.;kulde
"Kjøleaggregat skal monteres på vibrasjonsdempere og ha støydempet kapsling i tråd med prosjekterte lydkrav; montasje dokumenteres.";kulde
"Kuldeanlegg skal ha lekkasjealarm med automatisk stans ved grenseverdi og alarm til SD; funksjonstest og hendelseslogg vedlegges.";rørlegger
"Kuldemedierør skal være av kobber iht. EN 12735 og sertifisert for prosjektert trykk; loddeforbindelser utføres av sertifisert personell.";kulde
"Kjøleanlegg skal trykktestes med tørt nitrogen, vakuumeres til < 500 mikron og lekkasjekontrolleres iht. F-gass før igangkjøring; protokoll leveres.";kulde
"Regulator skal logge driftstemperatur og alarmhistorikk med tidsstempel; logger skal kunne eksporteres (CSV/Excel).";byggautomasjon
Isvannssystemet skal ha nødstoppsystem (lokal E-STOP/SD) og sirkulasjonspumpe med variabel hastighet (VFD) med ÎT/Îp-styring.;rørlegger
Automatisk påfyllingssystem for frostvæske skal leveres inkl. konsentrasjonskontroll og tilbakestrømssikring.;rørlegger
"Alle tekniske anlegg skal integreres i SD via åpen protokoll (BACnet/IP eller Modbus TCP); komplett tag-/I/O-liste og trendoppsett skal leveres.";byggautomasjon, ventilasjon, elektro, rørlegger, totalentreprenør
"SD-anlegget skal ha grafisk brukergrensesnitt tilpasset byggherrens behov; prosessbilder, alarmliste med kvittering, trendbilder og rapporter skal inngå.";byggautomasjon
"Alle alarmer fra tekniske systemer skal vises i SD-anlegget med prioritet, tidsstempel og kvitteringslogg; eskalering iht. varslingsmatrise og loggopphold â¥ 12 mnd.";byggautomasjon
Alle signaler fra teknisk utstyr skal ha komplett tag-liste/IO-matrise (adresse, enhet, skala, retning, alarmgrenser, trend) levert i CSV/XLSX.;byggautomasjon
"Det skal leveres automatisk trendlogging av inneklima- og energidata (T, RF, COâ, kWh) med oppløsning â¤ 15 min og lagring â¥ 12 mnd; data skal kunne eksporteres.";byggautomasjon
SD-server skal ha automatisk sikkerhetskopi minst ukentlig med lagring â¥ 3 måneder og dokumentert test-gjenoppretting.;byggautomasjon
SD-skjermen skal ha touch-panel og være veggmontert i teknisk rom.;byggautomasjon
Alle logger (trend, alarm, hendelse) skal kunne eksporteres til CSV/XLSX for valgte tidsrom.;byggautomasjon
Alle regulatorer (DDC) i SD-anlegget skal være fritt programmerbare og støtte åpen protokoll (BACnet/Modbus).;byggautomasjon
Anlegget skal kunne fjernstyres via VPN med MFA, kryptert forbindelse og audit-logg for pålogging/handlinger.;byggautomasjon
FDV-dokumentasjon skal leveres digitalt iht. NS 3456 og omfatte DoP/DoC, datablad, O&M, serviceintervaller, reservedelsliste, serienummer/QR-koder og som-bygget (PDF/DWG).;ventilasjon
Vedlikeholdsintervaller for alle komponenter skal spesifiseres med frekvens, omfang og ansvar og inngå i FDV-plan.;elektro
Alle produktdatablader skal oppgi energiklasse/effektivitet og forventet levetid (timer/år) samt garanti.;rørlegger
FDV skal inkludere garantier, komplett leverandøroversikt med kontaktinformasjon og installasjonstegninger (as-built / som bygget).;byggautomasjon, ventilasjon, elektro, rørlegger, totalentreprenør
"Brukerveiledning for driftspersonell skal leveres på norsk i PDF og redigerbart format, og dekke daglig drift, vedlikehold, alarmhåndtering og feilsøking; versjonsnummer og dato skal fremgå.";byggautomasjon
"Systemansvarlige skal gis opplæring (min. 8 timer) i vedlikehold, alarmhåndtering og rapportering i SD; kursplan, deltakerliste og signert gjennomføringsprotokoll skal overleveres.";byggautomasjon
"Alle komponenter skal ha unik tag/ID som samsvarer med merking og FDV-register; samme ID skal brukes i tegninger, IO-/tag-liste, alarmer og trender.";byggautomasjon
"Hver teknisk komponent skal ha bestandig QR-kode som lenker til FDV-side med datablad, manual, reservedeler og serviceintervaller; QR/URL skal inkludere komponentens unik ID.";byggautomasjon, ventilasjon, elektro, rørlegger, totalentreprenør
FDV-dokumentasjon skal kunne oppdateres løpende i byggeiers system, være versjonsstyrt og strukturert per system/komponent (DoC/DoP, datablad, service, reservedeler, serienummer/QR).;totalentreprenør
"Bygget skal dokumentere energiklasse A iht. NS 3700/NS 3701; beregning gjennomføres etter NS 3031 med komplett inndatarapport.";totalentreprenør
"Det skal installeres energimålere på alle vannbårne varme- og kjølekretser; målere integreres i SD og logges med â¤ 15 min oppløsning.";byggautomasjon
Energiforbruk skal overvåkes via SD-anlegget med rapporter og eksport til CSV/Excel for valgte perioder.;byggautomasjon
Bygget skal oppnå spesifikt netto energibehov â¤ 95 kWh/mÂ²Â·år dokumentert etter NS 3031.;totalentreprenør
All belysning skal være LED med DALI-2 lysstyring (dagslys + bevegelse) og dokumenterte innstillinger i as-built.;elektro
"Oppvarming skal i hovedsak baseres på fjernvarme eller varmepumpe med dokumentert COP/SCOP; prioriteringslogikk skal beskrives.";rørlegger
Solavskjerming skal styres automatisk etter solinnstråling og romtemperatur med integrasjon mot SD og justerbare settpunkter.;byggautomasjon
Ventilasjonsaggregat skal ha varmegjenvinner med temperaturvirkningsgrad â¥ 85 % iht. EN 308/NS-EN 13053.;ventilasjon
Korridorer og fellesarealer skal ha bevegelsessensorer for belysning med etterlystid/min-nivå definert og dokumentert.;byggautomasjon
"Alt elektrisk utstyr skal være merket med energiklasse A eller bedre der energimerkeordning gjelder; dokumentasjon legges i FDV.";byggautomasjon
"Minst 10 % av årlig energibehov skal dekkes av lokal fornybar energi (f.eks. solceller); beregnet produksjon og måledata dokumenteres.";totalentreprenør
"Bygget skal ha automatisk nattsenking av temperatur i lavlastperioder; settpunkt og tidsplan skal være lagt inn i SD.";byggautomasjon
"Varmeisolasjon i klimaskallet skal tilfredsstille passivhusstandard; U-verdier og tykkelser dokumenteres i energiberegning/tegningsgrunnlag.";totalentreprenør
Energibruk skal dokumenteres iht. TEK17 Â§ 14-2 med periodiske rapporter fra SD og sammenstilling mot budsjett.;totalentreprenør
"Kjøleanlegg skal ha frikjølingsfunksjon der utetemperatur/kilder gjør det hensiktsmessig; styringskriterier beskrives og testes.";rørlegger
"Tappevannsoppvarming skal primært skje via varmepumpe eller solfangere der dette er mulig; dekningsgrad og temperaturregime dokumenteres.";rørlegger
Automatiske avlesere for strøm, varme og vann skal gi månedlige rapporter og historikktilgang (CSV/Excel) via SD.;byggautomasjon
Prosjektet skal levere en Energioppfølgingsplan (EOP) med KPI-er, roller, rapportfrekvens, alarmgrenser og avviksbehandling.;totalentreprenør
"Energibudsjett skal utarbeides og oppdateres gjennom hele prosjektet; månedlige avvik mot faktisk forbruk skal analyseres og loggføres.";totalentreprenør
Tiltak for å redusere transmisjonstap (U-verdier, kuldebroer, tetthet) skal dokumenteres i energiberegningen med referanse til benyttede løsninger.;totalentreprenør
Varmepumpens årsvarmefaktor (SCOP) skal være minimum 4,2 for gjennomsnittlig klima.;kulde
Kjølemaskinens energieffektivitetsforhold (EER) skal være minst 3,1 ved nominelle forhold.;kulde
For DX-anlegg skal sesongbasert energieffektivitet (SEER) tilfredsstille energiklasse A++.;kulde
Varmepumpens ytelseskoeffisient (COP) for varmedrift skal dokumenteres ved A7/W35.;kulde
Kjølekapasiteten skal være tilstrekkelig for å dekke et beregnet effektbehov på minimum 50 kW.;kulde
Kuldemedium som benyttes skal ha en GWP-verdi (Global Warming Potential) på under 750.;kulde
Alt arbeid på kuldekretsen skal utføres av F-gass sertifisert personell kategori I.;kulde
Maskinrom for kjølemaskin skal utstyres med lekkasjevarsling for kuldemedium i henhold til NS-EN 378.;kulde
Det skal føres et komplett f-gass regnskap for anlegget, som overleveres byggherre ved ferdigstillelse.;kulde
Kjølemaskin skal trykktestes med tørt nitrogen før fylling av kuldemedium.;kulde
Støynivå fra utendørs plassert kondensator skal ikke overstige 45 dBA ved nabogrense.;kulde
Alle kuldemedierør skal isoleres med diffusjonstett cellegummi for å forhindre kondens.;kulde
Kondensvann fra fordamper og fan coils skal føres til nærmeste sluk med tilstrekkelig fall.;kulde
Det skal benyttes scroll-kompressorer for å sikre energieffektiv og stillegående drift.;kulde
Anlegget skal vakuumeres til under 500 mikron før fylling for å fjerne fuktighet fra kretsen.;kulde
Kjøleanlegget skal ha mulighet for frikjøling via tørrkjøler når utetemperaturen er lav nok.;kulde
Start/stopp-signal og overordnet settpunkt for kjølemaskinen skal kunne styres fra SD-anlegget.;kulde
For varmepumper skal det installeres automatisk avrimingsfunksjon for utedelen.;kulde
Det skal leveres komplett FDV-dokumentasjon for kjøleanlegget, inkludert datablader for alle hovedkomponenter.;kulde
Protokoll fra trykktesting og vakuumering av kjølesystemet skal inkluderes i overleveringsdokumentasjonen.;kulde
Totalentreprenør er ansvarlig for at krav til luftlydisolasjon og trinnlydnivå er i samsvar med NS 8175, klasse C.;totalentreprenør
Byggets bæresystem skal være dimensjonert for en generell nyttelast på minimum 3 kN/mÂ² i alle kontorarealer.;totalentreprenør
Skallsikring av byggets ytre avgrensning, inkludert vegger og vinduer, skal tilfredsstille kravene i FG-klasse 2.;totalentreprenør
Det skal dokumenteres at radonnivå i bygget er under tiltaksgrensen på 100 Bq/mÂ³.;totalentreprenør
Prinsippene for universell utforming i henhold til NS 11001 skal legges til grunn for alle adkomstveier og fellesarealer.;totalentreprenør
Alle innervegger som skiller mellom ulike romtyper skal oppfylle de spesifiserte R'w-lydkravene i lydrapporten.;totalentreprenør
Totalentreprenør skal lede og dokumentere tverrfaglig kollisjonskontroll i BIM-modell før utførelse.;totalentreprenør
Byggets tetthet mot luftlekkasjer skal måles og dokumenteres til å være i henhold til kravene i TEK17.;totalentreprenør
Fasadesystemet, inkludert vinduer og utvendig solavskjerming, skal være montert for å motstå lokale vind- og snølaster.;totalentreprenør
Kjølemaskin skal monteres på vibrasjonsdempere for å forhindre overføring av støy til bygningskonstruksjonen.;kulde
Isvannskretsen skal behandles med glykol og korrosjonsinhibitor for å beskytte varmevekslere og rør.;kulde
Platevarmeveksler mellom kuldekrets og isvannskrets skal være i syrefast stål (AISI 316).;kulde
krav til oppfølging/service av anlegg og utstyr angitt i FDV-dokumentasjon (fra leverandør/ entreprenør).Summen skal ikke inngå i tilbudssummen.;Uspesifisert
360.0004 betjener i hovedsak urene arealer i plan3.GENERELLE KRAVDokumentasjon i form av sertifikater, monteringsanvisning, drifts- og vedlikeholdsinstruks skal innngå som en del av FDV-dokumentasjonen.;Ventilasjon
Videre skal det kun benyttesfabrikkproduserte deler som bend, T-rør, avgreninger,dimensjonsendringer ol.;Rørlegger
Bygningsmessig tilluftsenhet [fabrikat/type] levert av annen entreprenør Kanal, type og dimensjon:;Ventilasjon
362 Kanalnett for luftbehandling er gjeldende, og ivaretagelse av disse skal medregnes.36.362.22.1Fancoil Kanal, type og dimensjon.;Ventilasjon
Transportkontainervask steriliseringsdel [fabrikat/type] levert av annen entreprenør Kanal, type og dimensjon:;Totalentreprenør
Avtrekksrist for montasje i rektangulær kanal med demonterbar front for rengjøring. Leveres med hvit lakkering som standard.;Uspesifisert
Leveres med bryter på arm med signal til motorspjeld (se egen post) og videre signal til SD om aktivert spjeld/bryter.;Ventilasjon
Leveres med bryter på arm med signal til motorspjeld (se egen post) og videre signal til SD om aktivert spjeld/bryter. Punktavsuget skal være robust og av høy kvalitet med hygenisk design.;Ventilasjon
For å unngå fuktig luft ut i arealet skal ventil utformes konisk (kanalovergang kan benyttes) og avsluttes med rist.;Ventilasjon
ut SD anlegget og kobler display mot aggregat/vifte.- Funksjonen er at hvis SD anlegget er ute av drift så skal man kunne styre kritiske ventilasjonsaggregat/vifter lokalt.;Ventilasjon
anlegget og kobler display mot aggregat/vifte.- Funksjonen er at hvis SD anlegget er ute av drift så skal man kunne styre kritiske ventilasjonsaggregat/vifter lokalt.;Uspesifisert
Man kobler evt. ut SD anlegget og kobler display mot aggregat/vifte.-;Uspesifisert
Leveres komplett med overganger til sirkulære kanaler.;Ventilasjon
a)Omfang og prisgrunnlag Kanalmontert vifte med EC-motor for dampavkast fra vaskeproosess.;Ventilasjon
Vifte skal ha BUS/Modus kommunikasjon, dvs.;Ventilasjon
Viffteleverandør skal levere med display/handkontroller/tablet (til lokal styring av vifte).;Ventilasjon
Denne skal plasseres i automasjonstavlen.;Ventilasjon
Man kobler evt. ut SD anlegget og kobler display mot vifte. Funksjonen er at hvis SD anlegget er ute av drift så skal man kunne styre kritiske vifter lokalt fra display.;Ventilasjon
Vifte startes ved røykdeteksjon i sjakt.;Ventilasjon
a)Omfang og prisgrunnlag Kanalmontert vifte med EC-motor.;Ventilasjon
Rør og lameller skal være epoksylakkerte. Varmebatteriet skal forberedes for montasje av temperaturgiver for frostvernsfunksjon som skal måle returvannstemperaturen i et av lamellrørene.;Rørlegger
Rør og lameller skal være epoksylakkerte. Batteriene skal være spylbare og ha oppsamlings- og avløpsmulighet ved rengjøring.;Rørlegger
#NAVN?;Ventilasjon
- Modulene for inspeksjon skal ha hengslede dører med håndtak, inspeksjonsvinduer med minimumstørrelse.;Ventilasjon
Spjeld komplett med motor36.364.41.1TFM-kode.;Ventilasjon
Spjeld komplett med motor36.364.55.1TFM-kode.;Ventilasjon
Spjeld komplett med motor36.364.63.1TFM-kode.;Ventilasjon
Utførelse Aggregat/vifteleverandør skal levere med display/handkontroller/tablet (til lokal styring av aggregat).;Ventilasjon
Utførelse Det skal taes hensyn til overlapp på mellom 5 og 10cm der isolasjonslamellen fjernes.;Ventilasjon
Overlappen skal stiftes med 10-15cm avstand.;Ventilasjon
Alle skjøter skal tapes med diffusjonstett aluminiumstape.;Ventilasjon
Utførelse Alle skjøter skal limes med produsentens spesiallim.;Ventilasjon
Isolering skal utføres ihht.;Uspesifisert
FOR VENTILASJONKlasse: e PM1-60%Type:;Ventilasjon
KANALNETT FOR LUFTBEHANDLINGKANALNETTKanalnettet skal utføres iht.;Ventilasjon
Ventilasjonsentreprenør leverer ogmonterer alt påfølgende utstyr i henhold tilnedenstående spesifikasjoner og produsentensmontasjeanvisning.;Ventilasjon
skal man kunne styre kritiske ventilasjonsaggregat/vifter lokalt.;Ventilasjon
a)Omfang og prisgrunnlag Skal kunne sende signal til SD-anlegg med drift/feil.;Ventilasjon
Det skal være med hjelpemann og iverksettes nødvendige tiltak ved inn/avkjørsel fra Jonas Lies Vei iht.;Uspesifisert
Krav og bruk av trafikkvakter skal ENT medta i sitt tilbud.;Uspesifisert
Med plenumskammer, spjeld og måleuttak.;Ventilasjon
Ventillfront med variable kastelengde. Leveres med hvit lakkering som standard.;Ventilasjon
12/17Â°CEtterkjølebatteri for montasje i kanal som skal dekke temperatursenking av tilluften til ønsket temperatur.;Ventilasjon
Med teleskopisk arm montert i tak/dekke, med 3 justerbare friksjonsledd.;Uspesifisert
Leveres komplett med skjerm og takkonsoll for innfesting og tilkobling av kanal.;Ventilasjon
Leveres med bryter på arm med signal til motorspjeld (se egen post) og videre signal til SD om aktivert (AV/PÃ) spjeld/bryter.;Ventilasjon
Leveres med bryter på arm med signal til motorspjeld (se egen post) og videre signal til SD om aktivert (AV/PÃ) spjeld/bryter. Punktavsuget skal være robust og av høy kvalitet med hygenisk design.;Ventilasjon
Rist med liggende lameller;Ventilasjon
Tilluftsventil for åpen montasje med demonterbar front for rengjøring. Leveres med hvit lakkering som standard.;Ventilasjon
Med plenumskammer og spjeld;Ventilasjon
Kondensavfukter med varmepumpe og kjøleflate Kapsling:;Ventilasjon
Med flenser mot vegg;Ventilasjon
Luftmengde: 100 mÂ³/h Dimensjon på tilluftsenhet:;Ventilasjon
Luftmengde: 5700 mÂ³/h Temperaturvirkningsgrad: 70%Temperatur/relativ fuktighet før gjenvinner (avtrekksluft):;Ventilasjon
Sentralstøvsuger GENERELLE KRAVDokumentasjon i form av sertifikater, monteringsanvisning, drifts- og vedlikeholdsinstruks skal innngå som en del av FDV-dokumentasjonen.;Ventilasjon
Kanalmontert med tilslutning i topp.;Ventilasjon
Tilluftsventil for montasje i systemhimling med demonterbar front for rengjøring.;Ventilasjon
Tilluftventil for montasje i vegg/skjørt med demonterbar front for rengjøring.;Ventilasjon
anlegget ved en kontakt.;Ventilasjon
Anmeldelser Alle nødvendige anmeldelser til kontrollmyndighetene påhviler entreprenøren, og anlegget skal være godkjent av kontrollmyndighetene før det blir fremlagt til overlevering.;Uspesifisert
Dokumentasjon av tilbud Alle fabrikater/typer skal oppgis og det må på oppfordring kunne oversendes datablader som dokumenterer utstyr og komponenter komplett.;Uspesifisert
Hele bygget Andel av kanalmassen som skal prøves.;Ventilasjon
Hele bygget Løs masse for prøving og måling.;Totalentreprenør
a)Omfang og prisgrunnlag Hulltaking, slissing i støpte/bærendekonstruksjoner samt tetting/branntetting inngår iannen entreprise.;Uspesifisert
a)Omfang og prisgrunnlag Skal kunne måle ned til 0,1 m/s.;Ventilasjon
K501 automasjonsentreprenør skal motta signaler fra følere/givere.;Byggautomasjon
Sensor skal være analog 4-20m A, alternativt kan det benyttes sensor med kommunikasjon.;Uspesifisert
a)Omfang og prisgrunnlag Leveres med kullfilter.;Ventilasjon
Det skal leveres fire stk. nye ventilasjonanlegg som skal ivareta grunnventilasjon, samt en rekke mindre anlegg som skal ivareta. avtrekk fra prosessanlegg og lokal kjøling.;Ventilasjon
Tilluftsventil for renrom med terminalfilter type;Ventilasjon
