ï»¿tekst;fag
Entreprenør skal i god tid før bestilling av sine leveranser innlede dialog med prosjektets automasjonsleverandør for å avklare forutsetninger og krav, slik at eventuelle feilbestillinger unngås.;byggautomasjon, ventilasjon, elektro, rørlegger, totalentreprenør
Det etableres låsbare servicebrytere foran alt utstyr med elektrisk tilkobling som har skadepotensiale ved drift- og vedlikeholdsaktiviteter pga. sin art, f.eks. pumper, vifter, større utstyr som elektrokjeler, varmepumper, kjølemaskiner mm.;ventilasjon, elektro, rørlegger, totalentreprenør
Ventilasjonsanlegg [AHU-xx] skal ha SFP â¤ 1,8 kW/(mÂ³/s) ved prosjektert luftmengde. Verifiseres ved måling iht. NS-EN 13053/ISO 5801. Målerapport vedlegges.;ventilasjon
Varmegjenvinner i [AHU-xx] skal ha temperaturvirkningsgrad â¥ 80 % ved dimensjonerende forhold. Dokumenteres med ytelsesdata/test iht. EN 308/NS-EN 13053.;ventilasjon
SD-anlegget skal holde rom-COâ â¤ 800 ppm (95-persentil) i kontortid ved normal belastning. Sensorer: nøyaktighet Â±(50 ppm + 3 %). Verifiseres med 14 døgn trendlogg og stikkprøvemåling i felt.;byggautomasjon
"Alle VAV-soner skal behovsstyres på COâ/temperatur (kaskade) med prosjekterte q_min/q_max pr. sone. Innreguleres og dokumenteres iht. NS-EN 12599; trendlogg â¥ 72 timer viser settpunktoppnåelse.";byggautomasjon
Møterom [M-xx] skal ha luftmengde q = max(7 l/sÂ·pers, 2,5 mÂ³/mÂ²h) ved fullt belegg ([antall pers]). Toleranse Â±10 %, verifiseres med innreguleringsprotokoll iht. NS-EN 12599.;ventilasjon
Hovedkanalnett (tilluft/avtrekk) skal ha trykkfall Îp â¤ 150 Pa ved prosjektert luftmengde. Dokumenteres med kanaldimensjonering og feltmåling (tappemålepunkt) iht. NS-EN 12599.;ventilasjon
"Tilluftfilter i ventilasjonsanlegget skal være min. ePM1 60 % iht. EN ISO 16890; alarmgrense for trykkfall skal oppgis og filterbytte dokumenteres i FDV";ventilasjon
"Inntak og avkast skal plasseres slik at resirkulasjon unngås; korteste frie avstand skal være â¥ 8 m (hor./vert.) og fremgå målsatt på tegning.";ventilasjon
"Trapperom skal trykksettes iht. NS-EN 12101-6; differansetrykk mot korridor skal være â¥ 50 Pa (dør lukket) og funksjon verifiseres ved test.";ventilasjon
Alle VAV-soner skal integreres i SD-anlegget via Modbus/BACnet med overføring av settpunkt, vMin, vMaks, posisjon og alarmer.;byggautomasjon
"VAV-spjeld skal leveres med Modbus-kommunikasjon og fabrikkalibrert mengdemåling (q); kalibreringsprotokoll skal vedlegges.";ventilasjon
"Hele kanalnettet (tilluft/avtrekk) skal innreguleres iht. NS-EN 12599; målt luftmengde per uttak skal være innenfor Â±10 % av prosjektert verdi, og innreguleringsprotokoll skal vedlegges.";ventilasjon
"Kjøkkenavtrekk skal utføres som separat system; hetter i rustfritt stål og egen avkastkanal, uten sammenkobling til øvrige ventilasjonssystemer.";ventilasjon
Leveransen skal ha oppetid â¥ 99,9 % pr. kalendermåned (planlagt vedlikehold unntatt) og dokumenteres med systemlogg.;byggautomasjon, ventilasjon, elektro, rørlegger, totalentreprenør
"Lydnivå i kontorareal skal være LA,eq â¤ 35 dB(A) i normal drift; måles iht. NS 8175 (klasse C)/NS-EN ISO 16032 og dokumenteres i målerapport.";byggautomasjon, ventilasjon, elektro, rørlegger, totalentreprenør
"Alle gjennomføringer (rør/kanal/kabel) i brannklassifiserte vegger og dekker skal branntettes til påkrevd klasse (min. EI60) med sertifisert system; fotodokumentasjon og produktdatablad skal vedlegges.";byggautomasjon, ventilasjon, elektro, rørlegger, totalentreprenør
"Alle kabler skal ha entydig, maskinprintet merking i begge ender og i koblingspunkter, iht. NEK 400 og prosjektets merkeregister; merketekst skal samsvare med tag-/kursnummer i som-bygget dokumentasjon.";elektro
FDV-dokumentasjon skal leveres komplett og digitalt ved overlevering, strukturert pr. system iht. NS 3456 og inkludere datablader, samsvarserklæringer, service-/vedlikeholdsintervaller, reservedelsliste, serienummer/QR-koder og som-bygget tegninger (PDF/DWG).;kulde
"Ventilasjonsaggregat [AHU-xx] skal ha temperaturvirkningsgrad â¥ 85 % ved dimensjonerende forhold; dokumenteres med ytelsesdata/test iht. EN 308/NS-EN 13053.";ventilasjon
"Alle rørgjennomføringer i brannklassifiserte vegger og dekker skal branntettes til påkrevd klasse (min. EI60) med typegodkjent system; montasje etter produsentens anvisning, fotodokumentasjon og sertifikat vedlegges.";rørlegger
"Totalentreprenør skal sikre at alle underleverandører etterlever SHA-plan, Byggherreforskriften og prosjektets HMS-prosedyrer; krav innarbeides i kontrakter, kontrolleres i vernerunder og loggføres.";totalentreprenør
"Det skal utarbeides en detaljert fremdriftsplan (WBS, avhengigheter, milepæler, kritisk linje) som oppdateres ukentlig og oversendes byggherre for godkjenning; plan leveres i maskinlesbart format og PDF.";byggautomasjon, ventilasjon, elektro, rørlegger, totalentreprenør
"Leveransen skal være fullt kompatibel med eksisterende SD-anlegg via BACnet/IP; nødvendig lisensiering/nettverksoppsett og komplett punkt-/tag-liste skal leveres og FAT/SAT-testes for interoperabilitet.";byggautomasjon
"Alle hovedmaterialer skal ha tredjepartsverifisert EPD iht. EN 15804; EPD-ID/versjon skal oppgis og legges i FDV før bestilling.";totalentreprenør
"Leveransen skal inkludere full programmering, I/O-test, funksjons-/integrasjonstest og igangkjøring av tekniske anlegg; testprotokoller og as-built-parametre skal overleveres.";byggautomasjon
"Entreprenøren skal innhente alle nødvendige offentlige tillatelser/godkjenninger før oppstart (byggesak, netteier, gravemelding, brann, F-gass m.fl.); kopi av vedtak/kvitteringer skal vedlegges.";byggautomasjon, ventilasjon, elektro, rørlegger, totalentreprenør
"All fast belysning skal styres via DALI med gruppe-/scenestyring, dagslysstyring og bevegelsesdeteksjon; adressering/konfigurasjon dokumenteres i as-built og FDV.";byggautomasjon
"Hovedtavle H-T1 skal ha overspenningsvern (SPD) type 2 iht. NEK 400-534; merke- og testdokumentasjon vedlegges.";elektro
"Alle sanitærinstallasjoner skal trykkprøves til 1,5 Ã driftstrykk i â¥ 2 timer uten trykkfall; signert trykkprøveprotokoll overleveres rørlegger.";rørlegger
"Luftmengde per rom skal måles og dokumenteres i egen innreguleringsrapport iht. NS-EN 12599; avvik fra prosjektert verdi â¤ Â±10 %.";ventilasjon
Bærende stålkonstruksjoner skal brannmales til R60 iht. NS-EN 13501-2 med dokumentert våt-/tørrfilmtykkelse.;totalentreprenør
"Alt byggeavfall skal kildesorteres iht. prosjektets avfallsplan; sorteringsgrad â¥ 95 % dokumenteres med veiesedler og månedsrapport.";byggautomasjon, ventilasjon, elektro, rørlegger, totalentreprenør
"Det skal installeres energimålere for varme og belysning (elektrisitet) i bygget; målerne skal integreres i SD-anlegget for logging og rapportering.";elektro
"Det skal installeres energimålere for varme, kjøling og elektrisitet i hver hovedsone; målerne skal integreres i SD-anlegget og logges med 15-minutters oppløsning.";byggautomasjon
"Byggherren skal få full opplæring i drift og vedlikehold av leverte tekniske anlegg før overtakelse; kursplan, deltakerliste og kursmateriell skal overleveres.";byggautomasjon, ventilasjon, elektro, rørlegger, totalentreprenør
Alle endringer og avvik fra kontraktsdokumentene skal varsles skriftlig og godkjennes skriftlig av byggherrens representant før gjennomføring.;byggautomasjon, ventilasjon, elektro, rørlegger, totalentreprenør
"Garantitid for utført arbeid og leverte materialer er 5 år fra overtakelsesdato; omfatter feil og mangler på arbeider og leverte produkter; garantiattest og kontaktpunkter overleveres.";kulde
"Nødlysanlegg skal prosjekteres og utføres iht. NS-EN 1838; krav til belysningsstyrke/jevnhet og autonomitid â¥ 1 h skal oppfylles; funksjons- og varighetstest dokumenteres.";elektro
"For alle plasstøpte betongkonstruksjoner skal det benyttes lavkarbonbetong klasse A; dokumenteres med leverandørspesifikasjon/EPD ved bestilling og i FDV.";totalentreprenør
"Alle pumper i varme- og kjøleanlegget skal være utstyrt med frekvensomformere for turtallsregulering; styring etter Îp/temperatur-settpunkter og integrasjon mot SD for start/stopp og alarm.";byggautomasjon
Alle pumper i varme- og kjøleanlegget må være utstyrt med frekvensomformere for turtallsregulering.;rørlegger
"Entreprenør skal delta i ukentlige byggemøter og månedlige fremdriftsmøter; faste representanter skal møte, og møtereferat";byggautomasjon, ventilasjon, elektro, rørlegger, totalentreprenør
"Alle tekniske rom skal ha gulvsluk med tilstrekkelig kapasitet; gulv skal ha fall mot sluk (min. 1:100), og sluk tilknyttes avløp med vannlås.";rørlegger
"Det skal leveres komplett sett Â«som byggetÂ»-tegninger i både PDF og DWG senest ved overtakelse; filene skal speile faktisk utførelse og inkludere revideringslogg og tegningsliste.";byggautomasjon, ventilasjon, elektro, rørlegger, totalentreprenør
"Sprinkleranlegget skal utføres som våtanlegg og dekke alle arealer iht. NS-EN 12845; hydraulisk beregning, dekningstegninger, trykk-/alarmprøver og funksjonstest skal dokumenteres.";rørlegger
"Fasadematerialer skal ha dokumentert forventet levetid â¥ 50 år ved normalt vedlikehold; leverandørens levetidsdokumentasjon/garanti og vedlikeholdsplan skal vedlegges.";totalentreprenør
"Alle utendørs stikkontakter skal være min. IP44 og beskyttes av jordfeilbryter (RCD) iht. NEK 400; kapslingsgrad og RCD-type skal fremgå av merkingen.";elektro
"Det skal etableres adgangskontrollsystem for alle ytterdører og tekniske rom; systemet skal støtte kort/ID, hendelseslogg og sentral administrasjon, og dører merkes med sone/tilgangsnivå.";elektro
"Akustiske tiltak skal sikre at LA,eq â¤ 45 dB(A) i kontorlandskap i drift; prosjekteres og verifiseres iht. NS 8175 (klasse C) med målerapport.";totalentreprenør
"Alle innendørs materialer skal være dokumentert lavemitterende (f.eks. M1/EC1/klasse A) og ikke avgi skadelige gasser; produktdatablader/sertifikater skal legges i FDV.";totalentreprenør
"Entreprenøren skal sørge for kontinuerlig renhold av byggeplassen gjennom hele prosjektperioden; daglig opprydding og ukentlig grovrengjøring skal loggføres.";totalentreprenør
"Alle vinduer og glassdører skal ha U-verdi â¤ 0,80 W/mÂ²K; samsvar dokumenteres med ytelsesdeklarasjon (DoP)/testrapport.";totalentreprenør
"Entreprenøren skal koordinere eget arbeid med øvrige fag; kollisjonskontroll i BIM gjennomføres før utførelse, og avvik håndteres i avvikslogg før produksjon.";byggautomasjon, ventilasjon, elektro, rørlegger, totalentreprenør
"Før overtakelse skal det gjennomføres fullskala integrert funksjonstest (SAT) av alle tekniske systemer med byggherre til stede; testprotokoller, avviksliste og utbedringer skal dokumenteres og være lukket før overtakelse.";byggautomasjon, ventilasjon, elektro, rørlegger, totalentreprenør
"Alle installerte komponenter skal være CE-merket; samsvar med gjeldende direktiver/standarder dokumenteres med EU-samsvarserklæring (DoC/DoP), testrapporter og produktdatablader i FDV.";byggautomasjon, ventilasjon, elektro, rørlegger, totalentreprenør
"Installasjon skal utføres i henhold til leverandørens montasjeanvisning og prosjektets tekniske beskrivelse; eventuelle avvik skal forhåndsgodkjennes skriftlig, og kontroll-/moment- og funksjonstester dokumenteres i sjekkliste.";byggautomasjon, ventilasjon, elektro, rørlegger, totalentreprenør
"Entreprenør skal føre digital fremdrifts- og avvikslogg gjennom hele byggeperioden; loggen oppdateres minst ukentlig og skal angi aktivitet, dato, ansvarlig, status, vedlegg (foto/protokoll), lukketdato og signatur, med mulighet for eksport til PDF/Excel.";byggautomasjon, ventilasjon, elektro, rørlegger, totalentreprenør
"Alle dørmiljøer der dette er angitt på tegning skal leveres med dørautomatikk og adgangskontroll; anlegget skal integreres med adgangssystem og brannalarmanlegg (fail-safe opplåsing ved alarm), oppfylle NS-EN 16005 og funksjonstestes ved overlevering.";elektro
"Det skal benyttes prefabrikkerte rørbøyler med integrerte vibrasjonsdempere i tekniske føringsveier; bæreevne og c/c-avstand skal følge produktblad, korrosjonsklasse â¥ C3, og montasje dokumenteres med moment/lastberegning.";rørlegger
"Alle tekniske føringer i himling skal koordineres i felles BIM-modell (min. LOD 300) og være kollisjonskontrollert før installasjon; ingen åpne hard-clashes mot bygg/andre fag, fri høyde iht. romprogram, og signert kollisjonsrapport skal foreligge.";byggautomasjon, ventilasjon, elektro, rørlegger, totalentreprenør
"Varmeanlegg [V-xx] skal reguleres via romfølere per sone og integreres i SD via BACnet/IP; settpunkt, modus, tur-/returtemperatur og alarmer skal være les/skriv.";byggautomasjon
"Alt automasjonsutstyr skal dokumenteres med serienummer, firmwareversjon og garantibevis; komplett serienummerliste legges i FDV.";byggautomasjon
"Det skal leveres målerapport som dokumenterer jordingsresistans â¤ 10 Î©; måling utføres og rapporteres iht. NEK 400.";elektro
"Alle branntettingsprodukter skal være sertifiserte for påkrevd klasse (min. EI60) og monteres av godkjente installatører; fotodokumentasjon og produktsertifikat vedlegges.";byggautomasjon, ventilasjon, elektro, rørlegger, totalentreprenør
"Alle skap og tavler skal ha entydig merking (tag/kursnr.) i dør/front og oppdatert oversiktsdokumentasjon som speiler faktisk utførelse; merking iht. NEK 400 og som-bygget.";byggautomasjon, elektro
"Ventilasjonskanaler skal isoleres med materiale A2-s1,d0 iht. NS-EN 13501-1; produktsertifikat og montasjeanvisning vedlegges.";ventilasjon
"Kabelbroer over himling skal monteres med c/c-avstand og lastklasse iht. produktblad; bro og skjøter skal jordes i begge ender og dokumenteres med kontinuitetsmåling.";elektro
"Før teknisk ferdigstillelse skal alle montasjer, tester og innreguleringer være dokumentert og godkjent; inkluder I/O-test, funksjonstest, innreguleringsprotokoll (NS-EN 12599) og lukket avviksliste.";byggautomasjon, ventilasjon, elektro, rørlegger, totalentreprenør
"Alt materiell skal ha tredjeparts EPD iht. EN 15804; ved likeverdige alternativer skal lavest GWP (A1âA3) velges og kortreist leveranse (â¤ 500 km fra byggeplass) benyttes; avvik skal begrunnes skriftlig.";byggautomasjon, ventilasjon, elektro, rørlegger, totalentreprenør
"Alt arbeid i høyden (> 2 m) skal utføres iht. Forskrift om utførelse av arbeid; det skal foreligge SJA, plan for arbeid i høyden, godkjent fallsikring/stillas/arbeidsplattform, dokumentert opplæring og daglig kontroll/merking.";byggautomasjon, ventilasjon, elektro, rørlegger, totalentreprenør
"Avvik fra plantegning eller spesifikasjon skal ikke utføres uten skriftlig forhåndsgodkjenning fra byggherrens representant; avvik skal beskrives med lokasjon, omfang og konsekvens.";byggautomasjon, ventilasjon, elektro, rørlegger, totalentreprenør
"Rom med vanninstallasjoner uten sluk skal ha automatisk vannstopp med lekkasjesensor og stengeventil på tilførsel; alarm og automatisk lukking ved deteksjon, funksjon testet og dokumentert ved overlevering.";rørlegger
"Varmesentralen skal ha alarmer for temperaturavvik og lekkasje med varsling til SD-anlegg/SMS/epost iht. varslingsmatrise; hendelser skal logges med tidsstempel.";rørlegger
"Sikkerhetsventilers avblåsningsrør skal føres til egnet oppsamlingspunkt/sluk med synlig drypptrakt; utløp merkes og utføres med fall.";rørlegger
"Alle skap og installasjoner i fellesareal skal leveres låsbare og inngå i byggets systemnøkkel; nøkkelplan og adgangsnivåer skal dokumenteres.";elektro
"Gulvvarmeanlegg skal ha separate reguleringssoner per rom; hver sone innreguleres og balanseres før overtakelse og dokumenteres med innreguleringsprotokoll.";rørlegger
"LED-nødlysarmaturer skal installeres i alle rømningsveier og tekniske rom iht. NS-EN 1838; autonomitid â¥ 1 h og funksjonstest dokumenteres.";elektro
"Alle motorer > 1,5 kW skal ha frekvensomformer tilpasset last; utstyret skal ha EMC-tilpasning og motorvern, og integreres mot SD for start/stopp og alarm.";byggautomasjon
"Alle midlertidige anlegg skal demonteres og området ryddes før overtakelse; avfall kildesorteres og ryddesertifikat legges ved.";byggautomasjon, ventilasjon, elektro, rørlegger, totalentreprenør
Ved ferdigstillelse skal det leveres komplett samsvarserklæring for de elektriske installasjonene iht. FEL/NEK 400, signert av ansvarlig installatør med måleprotokoller vedlagt.;elektro
"Innvendig luftkvalitet skal dokumenteres med målinger etter igangkjøring; COâ, temperatur, relativ fukt og partikler måles i representativt utvalg av rom og rapporteres mot prosjekterte grenseverdier.";byggautomasjon
"SD-anlegget skal logge temperatur, relativ fukt og COâ i minimum 14 sammenhengende døgn før overtakelse med oppløsning â¤ 15 min; trendrapporter vedlegges.";byggautomasjon
"Alle el-tavler skal være tydelig merket og ha oppdatert kursfortegnelse som samsvarer med faktisk utførelse; kursnummer, last og selektivitet skal fremgå.";byggautomasjon
"Alle føringsveier for elektro/IKT, rør og ventilasjonskanaler skal prosjekteres og utføres med min. 30 % ledig kapasitet for fremtidige utvidelser; reserverte gjennomføringer/hulltak skal etableres og målsattes på tegning.";elektro
Det skal leveres samsvarserklæring for alt elektrisk arbeid iht. FEL/NEK 400, signert av ansvarlig installatør, med måleprotokoller (isolasjon, jording, kontinuitet) vedlagt.;elektro
"Entreprenør skal beskytte alle installasjoner mot fukt, støv og mekanisk skade med tildekking/kapsling, tettepropper og emballering; beskyttelsen opprettholdes til overtakelse og kontrolleres i KS-sjekklister.";totalentreprenør
"Alle systemkomponenter skal ha dokumentert kompatibilitet med valgt SD-plattform (BACnet/IP eller Modbus TCP); BTL-/conformance-dokumentasjon, komplett tag-/I/O-matrise og vellykket FAT/SAT skal foreligge.";byggautomasjon, ventilasjon, elektro, rørlegger, totalentreprenør
Alle ventiler (inkl. motorventiler/spjeld) skal ha lokal posisjonsindikator (åpen/lukket eller 0â100 %), pil for strømningsretning der relevant, og entydig merking av funksjon/tag som samsvarer med som-bygget og FDV.;byggautomasjon, rørlegger
Driftssentralen skal være utstyrt med skjerm for visualisering av SD-anlegg og alarmer.;byggautomasjon
"Prosjekterende skal dokumentere at løsningene oppfyller TEK17 kap. 14 med energiberegning iht. NS 3031; rapport skal vise spesifikt netto energibehov, systemvirkningsgrader, U-verdier, SFP og inndata/antakelser, og etterlevelse bekreftes i samsvarserklæring.";byggautomasjon, ventilasjon, elektro, rørlegger, totalentreprenør
"Alle føringsveier over himling skal merkes med systemkode, retning (piler) og mål; merking utføres ved alle gjennomføringer/avgreninger og minst hver 5. meter, og skal samsvare med som-bygget.";elektro
Entreprenør skal overlevere komplett kontrollskjema for brannisolering av tekniske føringer med lokasjon, produkt-/systemtype, EI-klasse, montør, dato og fotodokumentasjon.;elektro
"Avfallsplan skal oppdateres månedlig og dokumenteres med veiesedler og sorteringsgrad per fraksjon; månedlig rapport arkiveres.";totalentreprenør
"Nødstrømsaggregatets funksjonssikkerhet skal fullbelastningstestes (â¥100 % nominell last) før overlevering, inkl. automatisk inn-/utkobling og lastovertak; testprotokoll skal vedlegges.";elektro
"Prefabrikkerte føringsveier skal benyttes der det er hensiktsmessig for å redusere montasjetid (repetitive strekk/moduler); leveransen skal være BIM-kollisjonskontrollert og inkludere mål, oppheng og utsparinger i tegning.";byggautomasjon, ventilasjon, elektro, rørlegger, totalentreprenør
"All prosjektering skal gjennomføres iht. NS 3935 (teknisk bygganalyse/ITB); forutsetninger, inndata, beregningsmodeller og resultater skal dokumenteres i versjonsstyrt prosjektrapport med tverrfaglig kvalitetssikring og signert samsvarserklæring.";byggautomasjon, ventilasjon, elektro, rørlegger, totalentreprenør
"SHA-planen skal være gjennomgått og signert av alle involverte (TE/UE/BH) før oppstart på byggeplass; signert versjon arkiveres i prosjekthotellet.";byggautomasjon, ventilasjon, elektro, rørlegger, totalentreprenør
"Alle ventilasjonskanaler og komponenter skal rengjøres til renhetsklasse M iht. NS-EN 15780 før idriftsettelse; rengjøringsrapport med foto/støvprøver vedlegges.";ventilasjon
Romkontrollere monteres på innvendig vegg 1,5 m over ferdig gulv (Â±100 mm), uten direkte sol/trekk/varmekilder, i tråd med innredningsplan.;byggautomasjon
"Kabelbroer skal jordes i begge ender med dokumentert kontinuitet (â¤ 0,5 Î©); måleprotokoll vedlegges.";elektro
Automatikkentreprenør skal levere komplett I/O- og tag-liste (signaltype, område, enhet, alarmgrenser, adresser) i CSV/XLSX for godkjenning før programmering.;byggautomasjon
Energiberegning iht. NS 3031 som dokumenterer etterlevelse av TEK17 kap. 14 skal foreligge og godkjennes før igangsettingstillatelse (IG).;totalentreprenør
"Varmevekslere skal dimensjoneres for maksimalt effektbehov ved â15 Â°C utetemperatur; dokumenter yteevne, ÎT og trykkfall i valg/beregning.";ventilasjon, rørlegger
"Alle rørføringer gjennom yttervegg skal tettes med typegodkjent mansjett og være dokumentert vanntette; montasje etter produsentens anvisning, fotodokumentasjon og tetthetsprøve vedlegges.";rørlegger
"Byggherrens krav til universell utforming skal oppfylles i alle fellesarealer iht. NS 11001-1; løsningene dokumenteres i som-bygget, sjekkliste og fotodokumentasjon.";totalentreprenør
"Hovedtavle skal gjennomgå visuell kontroll og termografering ved â¥ 75 % last, utført av sertifisert termografør (NEK 405-3); rapport leveres og avvik utbedres før overtakelse.";elektro
"Alle komponenter skal være CE-merket og dokumentert iht. gjeldende normer; DoP/DoC, testrapporter og produktdatablader legges i FDV.";elektro
"Entreprenør skal stille med kvalifisert driftsassistent i opplæringsperioden etter overtakelse; min. 40 timer on-site første måned, med opplæringsplan og signert deltaker-/feilrettingslogg.";byggautomasjon, ventilasjon, elektro, rørlegger, totalentreprenør
"Installasjoner i tekniske sjakter skal utføres med fri servicetilkomst â¥ 600Ã600 mm foran ventiler/spjeld/målere og inspeksjonsluker â¥ 500Ã500 mm; tilkomst og plassering skal fremgå av som-bygget.";byggautomasjon, ventilasjon, elektro, rørlegger, totalentreprenør
"Entreprenør skal utarbeide kapasitets- og sonekart for ventilasjonssystemet med VAV-ID, q_min/q_max og sonetilknytning; leveres i DWG/PDF og importeres i SD-grafikk før overtakelse.";ventilasjon
"Ventilasjonssystemet skal prosjekteres med lavt trykkfall: lufthastighet â¤ 3,0 m/s i hovedkanaler og â¤ 2,0 m/s i grenkanaler; beregnet trykkfall i hovedløp dokumenteres ved q_prosjekt.";ventilasjon
Det skal benyttes løsninger med lavt trykkfall for å sikre energieffektiv drift.;rørlegger
"Entreprenør skal sikre at alle leveranser oppfyller spesifikasjoner og kontraktstegninger gjennom ITP/KS-sjekklister; avvik meldes og godkjennes skriftlig før utførelse, og som-bygget skal speile levert løsning.";byggautomasjon, ventilasjon, elektro, rørlegger, totalentreprenør
"Alt sikkerhetsrelatert utstyr (heis, brannalarmanlegg, nødlys) skal ha nødstrømsforsyning med ATS â¤ 15 s; kapasitet â¥ 1 h for brann-/nødlys og evakueringskjøring av heis til nærmeste plan; full belastningstest og protokoll vedlegges.";elektro
"Alle ventiler/spjeld i ventilasjonsanlegget skal ha fri servicetilkomst â¥ 600Ã600 mm (inspeksjonsluke â¥ 500Ã500 mm) og merkes med funksjon/tag og pil for luftretning; merking skal samsvare med som-bygget/FDV.";ventilasjon
"Hovedkanalnett (tilluft/avtrekk) skal ha trykkfall Îp â¤ 200 Pa ved prosjektert luftmengde; dokumenteres med beregning og feltmåling iht. NS-EN 12599.";ventilasjon
"Samtlige VAV-spjeld skal ha Modbus (RTU/TCP) for integrasjon mot SD; minimum q_sett, q_mål, posisjon, alarm/status skal overføres; adresse-/registerliste og protokoll vedlegges.";ventilasjon
"Alle el-tavler skal ha entydig utvendig merking og oppdatert kursfortegnelse samt nødinformasjon (nødfrakobling, kontaktinfo); enkeltlinjeskjema skal være oppslått; utførelse iht. FEL/NEK 400.";elektro, byggautomasjon
"Kabelbroer over himling skal festes med innfestninger og c/c-avstander iht. produktblad og statiske beregninger; gjennomføringer/innfestninger skal oppfylle prosjekterte brannkrav og dokumenteres.";elektro
"Kjølerom og teknisk rom for kuldeanlegg skal ha lekkasjevakt for kuldemedium med alarm til SD og automatisk stans iht. varslingsmatrise; funksjonstest dokumenteres.";rørlegger
"Alle rør skal isoleres med mineralull iht. NS-EN 14303; isolasjonstykkelse iht. beregning og kontinuerlig dampbarriere med tette skjøter der fuktrisiko foreligger; montasje dokumenteres.";rørlegger
"Ventilasjonskanaler i brannseksjoner skal utføres i stål og utstyres med sertifiserte brannspjeld iht. prosjektert EI-klasse (smeltesikring/automatisk utløsning); montasje etter produsentens anvisning.";ventilasjon
"Automatikkskap skal leveres ferdig koblet, merket og FAT-testet før montasje; skjema/IO-liste og testprotokoll vedlegges.";byggautomasjon
"Temperaturfølere til SD-anlegget skal ha nøyaktighet Â±0,5 Â°C; feltkalibreres mot referanse ved idriftsettelse; kalibreringsprotokoll legges i FDV.";byggautomasjon
"Alle kuldemedier skal oppfylle F-gassforordningen; type, mengde og GWP dokumenteres i f-gass-logg; arbeid utføres av sertifisert personell (kategori I).";kulde
